event_id,datetime_utc,datetime_local,date,date_uncertain,time_local,time_known,time_precision,time_label,time_category,time_note,region,city,place,refs,event_zh,context_zh,source_chapter
E0230,1947-03-18,1947-03-18,1947-03-18,False,,False,fuzzy,同樣在3月18日,白天,,其他,南京市,,66.0,同樣在3月18日，蔣介石有一封電報經由長官公署轉蔣經國，謂「來電悉，望於二日或三日內返京為要。」,比較起來，蔣、陳關係似乎遠比蔣、白關係親近。關於新任省主席人選，陳儀曾在3月17、18日兩個晚上與蔣經國談話，徵求他同意接任省主席，但蔣經國「堅決拒絕」不肯應承，陳儀「不得已」才又向蔣介石推薦（秘書長）吳鐵城接任省主席，（財政處長）嚴家淦擔任秘書長。同樣在3月18日，蔣介石有一封電報經由長官公署轉蔣經國，謂「來電悉，望於二日或三日內返京為要。」蔣經國到底來臺灣做什麼？他向蔣介石報告什麼？目前尚乏資料而難窺究竟。,ch03_0001_1.2_二白崇禧向陳儀的立場靠攏
E0231,1947-03-18,1947-03-18,1947-03-18,False,,False,fuzzy,,,,其他,南京市,,140.0,第二天蔣介石即予回答：「收復臺灣勞苦功高，不幸變故突起致告倦勤殊為遺憾，現擬勉從尊意，准先設立臺灣省政府，至長官公署須待省府成立秩序完全恢復時准予定期取消，惟此時仍須兄負責主持善後，勉為其難也。」,在國民政府內部，陳儀屬於政學系，其與CC派、軍統、中統之間有著不同程度的矛盾，派系鬥爭在二二八甚至可能「引導事件的發展方向」。[136]從大溪檔案，也可以看到一些不利於陳儀的陳述，如憲兵司令張鎮在3月5日呈蔣的報告中說：「陳長官似尚未深悉事態之嚴重，猶粉飾太平」；[137]中統局局長葉秀峰也曾經報告：「陳長官善後處置仍採高壓政策，凡稍涉事變嫌疑者每加毒殺，被害者已有四、五十人，對青年學生妄殺尤多，致使人心惶惑社會益形不安。」[138]陳儀察知自己處境不利，乃於3月17日向蔣請辭：「謹乞鈞座念職衰老，不堪再膺繁劇，准予辭去臺灣省行政長官兼警備總司令本兼各職，另選賢能接替。」[139]第二天蔣介石即予回答：「收復臺灣勞苦功高，不幸變故突起致告倦勤殊為遺憾，現擬勉從尊意，准先設立臺灣省政府，至長官公署須待省府成立秩序完全恢復時准予定期取消，惟此時仍須兄負責主持善後，勉為其難也。」[140]蔣介石的處置不但顧及陳儀的面子，事實上也沒有一點責難之意。,ch03_0002_1.4_四蔣介石袒護陳儀臺省軍政首長事後無一受懲
E0232,1947-03-18T12:00:00Z,1947-03-18T20:00:00+08:00,1947-03-18,False,20:00,True,fuzzy,3月18日晚上,晚上,,其他,臺北市,,65.0,關於新任省主席人選，陳儀曾在3月17、18日兩個晚上與蔣經國談話，徵求他同意接任省主席，但蔣經國「堅決拒絕」不肯應承，陳儀「不得已」才又向蔣介石推薦（秘書長）吳鐵城接任省主席，（財政處長）嚴家淦擔任秘書長。,比較起來，蔣、陳關係似乎遠比蔣、白關係親近。關於新任省主席人選，陳儀曾在3月17、18日兩個晚上與蔣經國談話，徵求他同意接任省主席，但蔣經國「堅決拒絕」不肯應承，陳儀「不得已」才又向蔣介石推薦（秘書長）吳鐵城接任省主席，（財政處長）嚴家淦擔任秘書長。同樣在3月18日，蔣介石有一封電報經由長官公署轉蔣經國，謂「來電悉，望於二日或三日內返京為要。」蔣經國到底來臺灣做什麼？他向蔣介石報告什麼？目前尚乏資料而難窺究竟。,ch03_0001_1.2_二白崇禧向陳儀的立場靠攏
E0233,1947-03-19,1947-03-19,1947-03-19,False,,False,fuzzy,3月19日,白天,,其他,上海市,,69.0,白崇禧所謂的臺籍團體人民代表，例如臺灣省政治建設協會上海分會代表人張邦傑、臺灣重建協會上海分會代表人楊肇嘉、旅滬臺灣同鄉代表人李偉光等等曾於3月19日聯名發出「為挽救臺灣危局致于右任電」，其中認為慘案的起因雖是緝煙事件非法捕人殺人，而根本原因實在於臺灣行政制度之特殊化，陳儀不恤民意厲行專賣統制政策所一手造成，所以挽救之道包括「懲辦陳儀及軍警實際負責人」、「取消臺灣特有之專賣及省營貿易」等等,白崇禧抵臺甫滿一週，即向蔣介石發出洋洋灑灑的「養電」，分析事變的遠因、近因，指控「暴動」者的企圖「不僅如在京所聞係出於不滿現狀，自有關文件中獲悉⋯⋯則直欲奪取政權已無疑義」，所以原擬提前實行的縣市長民選，應該「再斟酌情形辦理」，專賣及貿易局制度今後如何改善也要「俟詳查實況再行報核」，總之今後治臺方針「與職在京所擬者確有修改之必要」3月23日白又向蔣報告：「此次臺變內容並不單純，共黨暴徒操縱煽動，蔓延既廣被害復大⋯⋯對臺事決定最好待職宣慰工作整個完成，報請鈞裁較為適當。近閱報載國內臺籍各團體人民代表，僅憑風說，提出種種要求，尚懇鈞座勿輕許諾，以免增加善後困難。」在同一張電文後面，有蔣介石親筆批示：「復准待宣慰工作完成，報告到後再定辦法；現並未有任何之許諾，陳長官查辦案亦已打銷，勿念。」白崇禧所謂的臺籍團體人民代表，例如臺灣省政治建設協會上海分會代表人張邦傑、臺灣重建協會上海分會代表人楊肇嘉、旅滬臺灣同鄉代表人李偉光等等曾於3月19日聯名發出「為挽救臺灣危局致于右任電」，其中認為慘案的起因雖是緝煙事件非法捕人殺人，而根本原因實在於臺灣行政制度之特殊化，陳儀不恤民意厲行專賣統制政策所一手造成，所以挽救之道包括「懲辦陳儀及軍警實際負責人」、「取消臺灣特有之專賣及省營貿易」等等，這樣的聲音在當時形成一定的壓力，事實上國民黨六屆三中全會在3月22日也有懲辦陳儀的決議，只是旋被蔣介石打銷罷了。,ch03_0001_1.2_二白崇禧向陳儀的立場靠攏
E0234,1947-03-20,1947-03-20,1947-03-20,False,,False,fuzzy,,,,其他,澎湖縣,馬公綏靖區,125,而在臺灣本島進入綏靖行動之後，本地區則於3月20日被劃為馬公綏靖區，由馬公要塞司令史文桂主持，展開「綏靖」各項工作。[125],澎湖地區在臺北二二八事件發生後，由於當地要塞駐軍強力固守，加上地方要員居中協調，使得地方顯得相當平靜，僅有一、二件騷動事件。而在臺灣本島進入綏靖行動之後，本地區則於3月20日被劃為馬公綏靖區，由馬公要塞司令史文桂主持，展開「綏靖」各項工作。[125]在「綏靖」期間，地方軍警除防止本島要犯潛逃至澎湖各島嶼外[126]，亦加強監控、搜捕「嫌疑份子」，然曾發生警察局長藉機報復，逮捕民眾之事。[127]「清鄉」工作則於4月14日開始，由地方軍警政三方面共同執行，但仍以軍方為主導，此期間除「搜捕嫌疑犯」、並收繳武器，截至5月15日告一段落。,ch02_0001_1.3.2.7_7_澎湖地區
E0235,1947-03-20,1947-03-20,1947-03-20,True,,False,fuzzy,「綏靖」期間,,指1947年3月20日開始之綏靖期間,其他,澎湖縣,澎湖各島嶼,126;127,在「綏靖」期間，地方軍警除防止本島要犯潛逃至澎湖各島嶼外[126]，亦加強監控、搜捕「嫌疑份子」，然曾發生警察局長藉機報復，逮捕民眾之事。[127],澎湖地區在臺北二二八事件發生後，由於當地要塞駐軍強力固守，加上地方要員居中協調，使得地方顯得相當平靜，僅有一、二件騷動事件。而在臺灣本島進入綏靖行動之後，本地區則於3月20日被劃為馬公綏靖區，由馬公要塞司令史文桂主持，展開「綏靖」各項工作。[125]在「綏靖」期間，地方軍警除防止本島要犯潛逃至澎湖各島嶼外[126]，亦加強監控、搜捕「嫌疑份子」，然曾發生警察局長藉機報復，逮捕民眾之事。[127]「清鄉」工作則於4月14日開始，由地方軍警政三方面共同執行，但仍以軍方為主導，此期間除「搜捕嫌疑犯」、並收繳武器，截至5月15日告一段落。,ch02_0001_1.3.2.7_7_澎湖地區
E0236,1947-03-20,1947-03-20,1947-03-20,False,,False,exact,3月20日後,不詳,,其他,全臺,,,根據警總與整編第21師所擬的「綏靖」計畫，自3月20日後將全臺劃分由5個「綏靖」區擴大為7個，以該區最高軍事單位主管為司令，並配合「綏靖」計畫，頒布「清鄉」計畫、「自新」辦法及情報部署。,中央派兵來臺後，陳儀隨即宣佈全臺戒嚴，各地自此進入恐怖捕殺時期。「綏靖」就是以武力鎮壓抗爭；「清鄉」則是清查戶口、搜捕可疑份子，並辦理「撫慰」、「自新」之工作。根據警總與整編第21師所擬的「綏靖」計畫，自3月20日後將全臺劃分由5個「綏靖」區擴大為7個，以該區最高軍事單位主管為司令，並配合「綏靖」計畫，頒布「清鄉」計畫、「自新」辦法及情報部署。計畫先以鞏固基隆、臺北、新竹防務為要，在控制臺北及週遭據點後，繼續分兵向南推進。[107]茲以全臺各地的「綏靖」和「清鄉」情形說明如下：,ch02_0001_1.3.2_二各地的整肅綏靖與清鄉
E0237,1947-03-20,1947-03-20,1947-03-20,True,,False,fuzzy,,不詳,此為3月20日後實施之計畫內容,其他,基隆、臺北、新竹,,107.0,計畫先以鞏固基隆、臺北、新竹防務為要，在控制臺北及週遭據點後，繼續分兵向南推進。[107],中央派兵來臺後，陳儀隨即宣佈全臺戒嚴，各地自此進入恐怖捕殺時期。「綏靖」就是以武力鎮壓抗爭；「清鄉」則是清查戶口、搜捕可疑份子，並辦理「撫慰」、「自新」之工作。根據警總與整編第21師所擬的「綏靖」計畫，自3月20日後將全臺劃分由5個「綏靖」區擴大為7個，以該區最高軍事單位主管為司令，並配合「綏靖」計畫，頒布「清鄉」計畫、「自新」辦法及情報部署。計畫先以鞏固基隆、臺北、新竹防務為要，在控制臺北及週遭據點後，繼續分兵向南推進。[107]茲以全臺各地的「綏靖」和「清鄉」情形說明如下：,ch02_0001_1.3.2_二各地的整肅綏靖與清鄉
E0238,1947-03-21,1947-03-21,1947-03-21,False,,False,fuzzy,3月21日,其他,,其他,基隆市,基隆、宜蘭,114.0,「綏靖」工作至3月21日，大致完成 [114],基隆、宜蘭地區之「綏靖」工作，主要由基隆要塞司令部全權指揮，整編21師438團第2營從旁協助。3月10日基隆要塞司令部奉命展開「綏靖」工作，是日派兵增援金包里駐軍，12日又派兵前往瑞芳、四腳亭、九份、金瓜石一帶鎮壓，並搜查淡水中學。3月15日，將宜蘭、蘇澳劃歸基隆「綏靖」區，重新部署兵力。[113]「綏靖」工作至3月21日，大致完成，據估計由基隆、宜蘭各地區補送「綏靖」部辦理者87人，其中死刑3人，被送勞動訓導營11人，未決8人，送總部12人，送法院8人，交保45人，另外俘獲武器則各式槍枝數千支、彈藥量達十萬之譜。[114]3月24日，「基隆綏靖司令部」依警總命令展開「清鄉」行動，徹底清繳武器、清查戶口、連保切結及「自新」工作，至4月12日結束。,ch02_0001_1.3.2.1_1_北基宜地區
E0239,1947-03-21,1947-03-21,1947-03-21,True,,False,,3月下旬,其他,視察之後,其他,臺北市,「綏靖清鄉」會議,79.0,返回臺北召開「綏靖清鄉」會議，會中警總參謀長柯遠芬說到「清鄉」計畫，主張「寧可枉殺99個，只要殺死1個真的就可以」，他還引用列寧的話謂「對敵人寬大，就是對同志殘酷」；白崇禧遂糾正他，要他今後對於犯案人民要公開逮捕、公開審訊、公開法辦。[79],同樣在4月17日，白崇禧主張懲處柯遠芬：「查現任臺灣警備總部參謀長柯遠芬，處事操切、濫用職權，對此次事變舉措尤多失當，且賦性剛愎不知悛改，擬請予以撤職處分，以示懲戒而平民忿。」蔣介石的批示是「應先調回候審」。[78]實則，白崇禧在後來的口述回憶當中，對柯遠芬亦頗有微詞，亦即當1947年3月下旬白崇禧赴臺灣各地視察之後，返回臺北召開「綏靖清鄉」會議，會中警總參謀長柯遠芬說到「清鄉」計畫，主張「寧可枉殺99個，只要殺死1個真的就可以」，他還引用列寧的話謂「對敵人寬大，就是對同志殘酷」；白崇禧遂糾正他，要他今後對於犯案人民要公開逮捕、公開審訊、公開法辦。[79],ch03_0001_1.3_三白崇禧與事變後的人事異動人員獎懲
E0240,1947-03-22,1947-03-22,1947-03-22,False,,False,fuzzy,3月22日,none,,其他,臺北市,,131,3月22日，監察院派遣監察委員何漢文來臺，協助楊亮功進行調查。,在「綏靖與清鄉」期間，國民政府為疏緩臺灣人民因軍事鎮壓所引起的恐慌與不滿，以及長官公署體制的不當，乃積極進行調查、「宣慰」與長官公署體制的改制。3月8日，福建臺灣監察使楊亮功奉派來臺查辦事變；3月10日，楊亮功對中央社記者發表談話指出：「中央對於臺省此次發生的不幸事件，極為關懷，特電令本人前來查辦。現本人剛到此間，一切情形尚欠明瞭，希望各方人士儘量供給意見，俾可轉達中央。本人以為目前最迫切之事，莫如發揮同胞愛之精神，不分彼此，迅即恢復社會秩序，安定人民生活。中央素以寬大為懷，蔣主席對於臺灣地方之重視及對於臺胞愛護之懇摯，可從蔣主席上次蒞臺時所發表之言論中見之，毋待贅述。本人相信中央對於此次事件必有合法合理之解決。」[129]楊氏隨即分赴行政長官公署、各軍警機關及學校，以及各縣市視察。3月17日，國防部部長白崇禧奉派偕同陸軍總部副參謀長冷欣、「三民主義青年團」中央團部第2處處長蔣經國等一行14人來臺「宣慰」。白崇禧抵台後，隨即對臺民廣播，宣示政府的「寬大」政策及處理原則，希望全臺同胞尊重法紀、迅速恢復社會秩序。[130]白氏在臺「宣慰」行程中，除走訪全台南北各地視察政府機關單位外，又與地方鄉親父老座談，藉此聽取各地人士意見，期間並要求軍警人員不得挾怨報復，嫌疑人犯皆應秉公速審，參加「暴動」青年學生免究等原則，因而使臺籍傷亡人數得以減少。3月22日，監察院派遣監察委員何漢文來臺，協助楊亮功進行調查。楊亮功、何漢文在臺調查事變期間，曾與國防部長白崇禧交換處理事變之意見，他們的職責雖不相同，但意見大致相似。[131]4月2日，白崇禧返回南京，結束約二週的「宣慰」行程。4月11日，楊亮功等亦搭船轉滬返京，除向監察院院長于右任報告二二八事件詳情，並就政治、經濟、教育、善後處理四方面撰擬報告書，建議今後改革意見；隨即晉見國民政府主席蔣介石，面陳事變經過。[132],ch02_0001_1.4_四調查宣慰與長官公署的改制
E0241,1947-03-22,1947-03-22,1947-03-22,False,,False,fuzzy,3月22日,白天,,其他,南京市,,,事實上國民黨六屆三中全會在3月22日也有懲辦陳儀的決議，只是旋被蔣介石打銷罷了。,白崇禧抵臺甫滿一週，即向蔣介石發出洋洋灑灑的「養電」，分析事變的遠因、近因，指控「暴動」者的企圖「不僅如在京所聞係出於不滿現狀，自有關文件中獲悉⋯⋯則直欲奪取政權已無疑義」，所以原擬提前實行的縣市長民選，應該「再斟酌情形辦理」，專賣及貿易局制度今後如何改善也要「俟詳查實況再行報核」，總之今後治臺方針「與職在京所擬者確有修改之必要」3月23日白又向蔣報告：「此次臺變內容並不單純，共黨暴徒操縱煽動，蔓延既廣被害復大⋯⋯對臺事決定最好待職宣慰工作整個完成，報請鈞裁較為適當。近閱報載國內臺籍各團體人民代表，僅憑風說，提出種種要求，尚懇鈞座勿輕許諾，以免增加善後困難。」在同一張電文後面，有蔣介石親筆批示：「復准待宣慰工作完成，報告到後再定辦法；現並未有任何之許諾，陳長官查辦案亦已打銷，勿念。」白崇禧所謂的臺籍團體人民代表，例如臺灣省政治建設協會上海分會代表人張邦傑、臺灣重建協會上海分會代表人楊肇嘉、旅滬臺灣同鄉代表人李偉光等等曾於3月19日聯名發出「為挽救臺灣危局致于右任電」，其中認為慘案的起因雖是緝煙事件非法捕人殺人，而根本原因實在於臺灣行政制度之特殊化，陳儀不恤民意厲行專賣統制政策所一手造成，所以挽救之道包括「懲辦陳儀及軍警實際負責人」、「取消臺灣特有之專賣及省營貿易」等等，這樣的聲音在當時形成一定的壓力，事實上國民黨六屆三中全會在3月22日也有懲辦陳儀的決議，只是旋被蔣介石打銷罷了。,ch03_0001_1.2_二白崇禧向陳儀的立場靠攏
E0242,1947-03-22,1947-03-22,1947-03-22,False,,False,fuzzy,白崇禧抵臺甫滿一週 (養電),白天,「養電」指22日電報,其他,臺北市,,67.0,白崇禧抵臺甫滿一週，即向蔣介石發出洋洋灑灑的「養電」，分析事變的遠因、近因，指控「暴動」者的企圖「不僅如在京所聞係出於不滿現狀，自有關文件中獲悉⋯⋯則直欲奪取政權已無疑義」，所以原擬提前實行的縣市長民選，應該「再斟酌情形辦理」，專賣及貿易局制度今後如何改善也要「俟詳查實況再行報核」，總之今後治臺方針「與職在京所擬者確有修改之必要」,白崇禧抵臺甫滿一週，即向蔣介石發出洋洋灑灑的「養電」，分析事變的遠因、近因，指控「暴動」者的企圖「不僅如在京所聞係出於不滿現狀，自有關文件中獲悉⋯⋯則直欲奪取政權已無疑義」，所以原擬提前實行的縣市長民選，應該「再斟酌情形辦理」，專賣及貿易局制度今後如何改善也要「俟詳查實況再行報核」，總之今後治臺方針「與職在京所擬者確有修改之必要」3月23日白又向蔣報告：「此次臺變內容並不單純，共黨暴徒操縱煽動，蔓延既廣被害復大⋯⋯對臺事決定最好待職宣慰工作整個完成，報請鈞裁較為適當。近閱報載國內臺籍各團體人民代表，僅憑風說，提出種種要求，尚懇鈞座勿輕許諾，以免增加善後困難。」在同一張電文後面，有蔣介石親筆批示：「復准待宣慰工作完成，報告到後再定辦法；現並未有任何之許諾，陳長官查辦案亦已打銷，勿念。」白崇禧所謂的臺籍團體人民代表，例如臺灣省政治建設協會上海分會代表人張邦傑、臺灣重建協會上海分會代表人楊肇嘉、旅滬臺灣同鄉代表人李偉光等等曾於3月19日聯名發出「為挽救臺灣危局致于右任電」，其中認為慘案的起因雖是緝煙事件非法捕人殺人，而根本原因實在於臺灣行政制度之特殊化，陳儀不恤民意厲行專賣統制政策所一手造成，所以挽救之道包括「懲辦陳儀及軍警實際負責人」、「取消臺灣特有之專賣及省營貿易」等等，這樣的聲音在當時形成一定的壓力，事實上國民黨六屆三中全會在3月22日也有懲辦陳儀的決議，只是旋被蔣介石打銷罷了。,ch03_0001_1.2_二白崇禧向陳儀的立場靠攏
E0243,1947-03-22,1947-03-22,1947-03-22,False,,False,fuzzy,,,,其他,臺北市,,130,陳儀又在3月22日致電桂永清：「本省此次事件承派三艦來臺協助平亂，至為感荷。茲太康號高艦長以臺局日趨平定，面請解除此間任務⋯⋯。」,關於蔣介石的派兵，較少被注意的是海軍部分。3月7日國民政府參軍處軍務局局長俞濟時把陳儀請兵的來電抄呈蔣介石，附註的地方出現一段海軍的消息：「本（10）日14時接海軍總部周參謀長憲章電話稱，接臺灣9日來電，基隆之叛兵司令部已為我海軍及要塞部隊驅逐，又盤據左營汽油廠之叛兵，已為我海軍肅清，俘獲百餘人，繳獲槍枝數十支等情。」126可見至少在基隆與高雄左營兩個海港，海軍發揮相當作用。從檔案可以看到早在3月7日，蔣介石即曾指令太康艦、伏波艦開赴基隆歸陳儀指揮，美頌、美樂二艦開赴左營由海軍司令黃緒虞指揮127，不過3月10日桂永清簽呈稱，美頌美樂二艦恐不能及時到達，已電飭戰車登陸艦「中海」由滬開基隆. 128臺灣省警備司令部在3月15日致電海軍總司令部：「太康中海已於真元先後抵基隆。」129陳儀又在3月22日致電桂永清：「本省此次事件承派三艦來臺協助平亂，至為感荷。茲太康號高艦長以臺局日趨平定，面請解除此間任務⋯⋯。」130所謂三艦，應是指太康、伏波、中海而言。海島臺灣發生事變，海軍的角色自是舉足輕重。,ch03_0002_1.3_三蔣介石調兵遣將
E0244,1947-03-22,1947-03-22,1947-03-22,False,,False,fuzzy,,,第八次會議,其他,南京市,,,進行到3月22日亦即第八次會議時，終於通過劉文島等55人連署的臨時動議，決定對臺灣省行政長官陳儀「撤職查辦」,然而，二二八事件爆發不久，國防最高委員會於3月5日、6日在南京國民政府會議室召開的常務會議，即連續討論臺灣事變，對臺灣的行政長官制度以及陳儀的作風多所批評；[141]而3月15日開幕的中國國民黨第六屆中央執行委員第三次全體會議，進行到3月22日亦即第八次會議時，終於通過劉文島等55人連署的臨時動議，決定對臺灣省行政長官陳儀「撤職查辦」，如本文第一節所述，蔣介石竟然運用總裁特權打消此議。,ch03_0002_1.4_四蔣介石袒護陳儀臺省軍政首長事後無一受懲
E0245,1947-03-23,1947-03-23,1947-03-23,False,,False,fuzzy,3月23日,白天,,其他,臺北市,,68.0,3月23日白又向蔣報告：「此次臺變內容並不單純，共黨暴徒操縱煽動，蔓延既廣被害復大⋯⋯對臺事決定最好待職宣慰工作整個完成，報請鈞裁較為適當。近閱報載國內臺籍各團體人民代表，僅憑風說，提出種種要求，尚懇鈞座勿輕許諾，以免增加善後困難。」,白崇禧抵臺甫滿一週，即向蔣介石發出洋洋灑灑的「養電」，分析事變的遠因、近因，指控「暴動」者的企圖「不僅如在京所聞係出於不滿現狀，自有關文件中獲悉⋯⋯則直欲奪取政權已無疑義」，所以原擬提前實行的縣市長民選，應該「再斟酌情形辦理」，專賣及貿易局制度今後如何改善也要「俟詳查實況再行報核」，總之今後治臺方針「與職在京所擬者確有修改之必要」3月23日白又向蔣報告：「此次臺變內容並不單純，共黨暴徒操縱煽動，蔓延既廣被害復大⋯⋯對臺事決定最好待職宣慰工作整個完成，報請鈞裁較為適當。近閱報載國內臺籍各團體人民代表，僅憑風說，提出種種要求，尚懇鈞座勿輕許諾，以免增加善後困難。」在同一張電文後面，有蔣介石親筆批示：「復准待宣慰工作完成，報告到後再定辦法；現並未有任何之許諾，陳長官查辦案亦已打銷，勿念。」白崇禧所謂的臺籍團體人民代表，例如臺灣省政治建設協會上海分會代表人張邦傑、臺灣重建協會上海分會代表人楊肇嘉、旅滬臺灣同鄉代表人李偉光等等曾於3月19日聯名發出「為挽救臺灣危局致于右任電」，其中認為慘案的起因雖是緝煙事件非法捕人殺人，而根本原因實在於臺灣行政制度之特殊化，陳儀不恤民意厲行專賣統制政策所一手造成，所以挽救之道包括「懲辦陳儀及軍警實際負責人」、「取消臺灣特有之專賣及省營貿易」等等，這樣的聲音在當時形成一定的壓力，事實上國民黨六屆三中全會在3月22日也有懲辦陳儀的決議，只是旋被蔣介石打銷罷了。,ch03_0001_1.2_二白崇禧向陳儀的立場靠攏
