event_id,datetime_utc,datetime_local,date,date_uncertain,time_local,time_known,time_precision,time_label,time_category,time_note,region,city,place,refs,event_zh,context_zh,source_chapter
E0059,1947-02-28,1947-02-28,1947-02-28,False,,False,fuzzy,,,,其他,臺灣省,臺灣,51,1947年臺灣發生二二八事件，白崇禧奉蔣之命擔任赴臺「宣慰」的中央大員，大約半個月的時間相當程度介入二二八事件的善後處理,1946年即中日戰爭結束的第二年，白崇禧得到美國和何應欽的支持，擔任國防部長，但因參謀總長陳誠「是蔣的親信、非常跋扈」而總攬一切，白崇禧成為有職無權的空頭部長。[50]1947年臺灣發生二二八事件，白崇禧奉蔣之命擔任赴臺「宣慰」的中央大員，大約半個月的時間相當程度介入二二八事件的善後處理，有人說白崇禧於3月17日飛抵臺灣以後，宣佈中央處理事變的四項基本原則，「危機卒告解除」[51]，其實是過度簡化、甚至偏離事實的講法，吾人透過當年電報函件等檔案材料，可以還原白崇禧在二二八事件善後處理中的角色，並給予適當的評價。,ch03_0001_1_第二節_國防部長白崇禧赴臺宣慰
E0060,1947-02-28,1947-02-28,1947-02-28,False,,False,fuzzy,28日,白天,,其他,臺北市,臺灣省行政長官公署,102.0,陳儀宣佈臨時戒嚴的同一天即以電報呈蔣：「臺省防共素嚴，惟27日奸匪勾結流氓，乘專賣局查禁私煙機會聚眾暴動，傷害外省籍人員，特於28日宣佈臨時戒嚴，必要時當遵令權宜處置。」[102],事變發生之初，陳儀宣佈臨時戒嚴的同一天即以電報呈蔣：「臺省防共素嚴，惟27日奸匪勾結流氓，乘專賣局查禁私煙機會聚眾暴動，傷害外省籍人員，特於28日宣佈臨時戒嚴，必要時當遵令權宜處置。」[102]3月1日，省黨部主任委員李翼中赴長官公署訪陳儀，問他「臺北軍警足供使用否？」陳儀回答「可勿慮」，等到3月5日事件仍未平息，李翼中再訪陳儀，就建議「何如速請中樞加派勁旅且選派大員為助，俾事件得早日敉平」，陳儀的回答是「余亦有此意」，於是李翼中自告奮勇攜帶陳儀的信函，於3月7日（6日無航機未成行）搭機飛南京，面見蔣介石於官邸，除報告臺灣情勢、善後方策，更表示「臺灣兵力薄弱，似非加派勁旅不足以資鎮懾，陳長官且望中央派大員協助處理。」蔣介石回答「已派兵前往，本日可達，余已決定派白部長赴臺宣慰。」[103]關於李翼中親手轉呈的信函，陳儀在其中詳述2月28日以來的經過情形、原因分析、處置態度，提到「此後對付臺灣之態度，⋯對於奸黨亂徒，須以武力消滅，不能容其存在」，最後還說：「鈞座可派大員來臺協同辦理，但為保持臺灣使其為中華民國的臺灣計，必須迅派得力軍隊來臺. 如派大員，亦須俟軍隊到臺以後，否則亦恐難生效力。」[104]一般以為簡派大員來臺是屬於安撫、和解的表示，與「武力解決」意義相反，但陳儀把它們視為一體，值得注意。陳儀的焦躁不安到了3月7日更為顯露，他覺得蔣決派第21師師部及步兵一團、憲兵一營來臺「不敷戡亂之用，擬請除第21師全部開來外，再加開一師，至少一旅，並派湯恩伯來臺指揮，在最短期間，予以澈底肅清。」[105],ch03_0002_1.2_二蔣介石掌握事變中的各種資訊
E0061,1947-02-28T05:00:00Z,1947-02-28T13:00:00+08:00,1947-02-28,False,13:00,True,fuzzy,下午約1點多,下午,,其他,臺北市,行政長官公署前（中山路路口）,67,下午約1點多，約四、五百名的群眾，以鑼鼓為前導，高喊口號地由臺北火車站走向長官公署請願。群眾方抵中山路路口，尚未到公署廣場前，即被公署衛兵舉槍阻擋前進。不久，槍聲噠噠作響，造成現場民眾2人身亡、數名受傷之慘狀，其餘民眾則四處躲避逃散。[67],下午約1點多，約四、五百名的群眾，以鑼鼓為前導，高喊口號地由臺北火車站走向長官公署請願。群眾方抵中山路路口，尚未到公署廣場前，即被公署衛兵舉槍阻擋前進。不久，槍聲噠噠作響，造成現場民眾2人身亡、數名受傷之慘狀，其餘民眾則四處躲避逃散。[67]民眾的示威、抗議、遊行，遭到官方無情的武力鎮壓，使得局面更加險惡，引爆群眾的憤怒情緒，一時之間高喊「打阿山」之聲不絕，臺北市街頓時陷入血腥暴力的混亂場面。民眾分據各交通要道、公共場所、旅館商店，只要看到「外省人」，不分男女，均以拳腳相向；汽車、卡車上的人紛被拉下毆打，車輛則被推至圓環夜市附近放火焚燒；外省籍公務員、憲兵、警察於南門、新公園、車站、本町（重慶南路）、永樂町（西寧北路）、太平町（延平北路）、萬華等地分被毒打，新竹縣長朱文伯、警備總部副官處處長王民寧皆差點遭受攻擊。外省人經營的公司也成為洩恨的目標，正華大旅社、虎標永安堂、新臺公司等數家門窗玻璃全被砸毀，商品貨物也被搬出焚燒。[68],ch02_0001_1.1_一導火線
E0062,1947-02-28T06:00:00Z,1947-02-28T14:00:00+08:00,1947-02-28,False,14:00,True,fuzzy,下午2時左右,下午,,其他,臺北市,中山公園（今二二八和平公園）臺灣廣播電臺,69,下午2時左右，有些群眾重新聚會在中山公園（今二二八和平公園），隨即佔據公園內的臺灣廣播電臺，向全臺廣播。其內容主要批判臺灣自戰後政治黑暗、貪污舞弊、米糧外運、民不聊生等現象，並呼籲民眾起來反抗，驅逐各地的貪官污吏以求生存。[69],下午2時左右，有些群眾重新聚會在中山公園（今二二八和平公園），隨即佔據公園內的臺灣廣播電臺，向全臺廣播。其內容主要批判臺灣自戰後政治黑暗、貪污舞弊、米糧外運、民不聊生等現象，並呼籲民眾起來反抗，驅逐各地的貪官污吏以求生存。[69]由於臺北的事件消息傳到全臺，使得原本單純的地區性緝煙懲凶的抗議活動逐步擴大，成為蔓延全臺各地的衝突事件。,ch02_0001_1.1_一導火線
E0063,1947-02-28T11:00:00Z,1947-02-28T19:00:00+08:00,1947-02-28,False,19:00,True,fuzzy,當晚,晚上,,其他,基隆市,警察局、派出所、機關宿舍,70,以基隆為例，在事件發生後當晚，已有群眾攻擊警察局、派出所、機關宿舍等，以及毆打外省人和軍人的情形。[70],自2月28日下午，臺北市發生長官公署前衛兵開槍事件，造成臺灣群眾累積已久的不滿情緒爆發而怒打「外省人」的情形後，消息透過電臺廣播及民眾口耳相傳，衝突事件因而逐漸擴大至全臺各地。如北部地區大多在當日下午或傍晚時分即傳出零星衝突：以基隆為例，在事件發生後當晚，已有群眾攻擊警察局、派出所、機關宿舍等，以及毆打外省人和軍人的情形。[70]隔日，板橋鎮秩序也失控，民眾陸續衝入縣府，毆打職員。部份群眾則襲擊供應局倉庫，搬走軍用物資，並放火燒毀倉庫；[71]士林與新店地區發生供應局物資被搶、武器被劫之情形；淡水、瑞芳等地則是毆打外省人，金瓜石銅礦籌備處職員宿舍被搗毀；[72]桃園鎮自1日起接收縣政府及驅趕警局官員；[73]新竹市則於3月2日清晨，有一批從臺北來到新竹的青年和學生，開著卡車到處演講，說明事件經過，並呼籲民眾參加起義。是時，市民開始毆打外省人，或是搗毀外省人經營的商店，或是分頭襲擊派出所、法院、市府機關 and 官員宿舍；[74]宜蘭因離臺北市有些距離，因此對事件的反應較慢，3月4日地方民眾收繳宜蘭機場倉庫及市警察局槍械，以及將外省人悉數集中保護和設立救護所，救護傷患。[75],ch02_0001_1.2.1_一各地衝突的擴大
E0064,1947-02-28T16:00:00Z,1947-03-01T00:00:00+08:00,1947-03-01,False,00:00,True,fuzzy,午夜,凌晨,,其他,蘇州,,94.0,3月1日，蘇州軍警午夜施行全城大搜查，捕去市民六百餘人。[94],當1947年2月國府軍在山東萊蕪被共軍大敗，總指揮李仙洲以下官兵約5萬人被俘，蔣介石在日記中說：「本月下旬，實為軍事最危急之時期也。」「二月既為我在軍事、經濟、政治上最拮据困難之一月，而英、美各國輿論之熱嘲冷罵，更為難堪，國內反動份子所謂『民主同盟』等又從而煽惑人心，擾亂社會，惟恐經濟政策之不速崩潰，故不惜竭其全力以求一逞，今後之困難，必日甚一日，可不蹈厲奮發乎。」[92]研究國共內戰以及二次世界大戰戰後中美蘇「三國四方」關係的學者，大致可以接受一個結論：美蘇之間在中國有限的相互遏制，使國共雙方可以依靠自己的實力和能力一競雄長；[93]進一步說，所謂實力和能力不全然指軍事方面，國民黨的失敗還包括政治方面之逐漸失去民心，例如1946年7月民盟活躍人士李公樸、聞一多先後被特務暗殺，又如1947年2月17日，北平市動員憲警八千餘人，午夜侵入民家大肆搜捕，前後一共捕去市民二千餘名；3月1日，蘇州軍警午夜施行全城大搜查，捕去市民六百餘人。[94]對此現象有論者分析道：「國民黨政府在各種各樣的危機襲擊下，已經喪失了功用。現在，它已經不能不採取公開的法西斯的恐怖統治了。」[95]當時著名的政論雜誌《觀察》週刊主編儲安平也歸納地說：「這二十年來國民黨只聚精會神在做一件事，就是加強消極的政治控制，以求政權的鞏固。」其結果當然影響到積極的建設工作，同時造成偏激者上梁山，中庸者潔身自好，柔弱者頹靡消沈，國家盡失棟梁、社會無復正氣，總之這是一種「失敗的統治」。[96],ch03_0002_1.1_一1947年前後的南京政府與蔣介石
E0065,1947-03-01T02:00:00Z,1947-03-01T10:00:00+08:00,1947-03-01,False,10:00,True,exact,上午10時,上午,,其他,臺北市,中山堂,83.0,臺北市參議會邀請臺籍國大代表、省參議員、國民參政員，於上午10時在中山堂成立「緝煙血案調查委員會」談起。在該會中決議，推派代表晉見陳儀，提出由官民共同組織處理委員會等五項請求[83],在各地混亂衝突之際，有部分地方人士與民意代表相率出面與官方交涉，提出改革之要求，即是在此次事件的風暴中心—臺北市成立「二二八事件處理委員會（簡稱處委會）」為主軸進展。臺北市處委會的成立可從3月1日，臺北市參議會邀請臺籍國大代表、省參議員、國民參政員，於上午10時在中山堂成立「緝煙血案調查委員會」談起。在該會中決議，推派代表晉見陳儀，提出由官民共同組織處理委員會等五項請求[83]，經由陳儀同意，乃於3月2日下午2時，假中山堂召開籌備會議，會中除公署代表周一鶚、胡福相、任顯群、游彌堅等4人出席外，民意代表及旁聽群眾之參與非常踴躍，使得會場顯得擁擠不堪。會中，除聽取市參議員張晴川報告與陳儀於當日上午交涉之情形外，又決定變更處委會組織，採納「臺灣省政治建設協會」等意見，由商會、工會、學生、民眾、政治建設協會五方選出代表參加處委會，以增加陣容、強化組織。之後，又經主席周延壽表示，陣容可再擴大，乃決議包括全臺各縣市參議員、國大代表等均可參與。[84]處委會內部組成份子因而轉趨複雜，其中不乏黑道、特務，以及相關利益人士，並且內部成員的派系爭權問題也逐漸浮上檯面，尤其以蔣渭川為主的政治建設協會與王添灯、陳逸松等人之間的傾軋排擠，最為明顯。,ch02_0001_1.2.2_二改革要求的提出
E0066,1947-03-01,1947-03-01,1947-03-01,False,,False,fuzzy,隔日,,,其他,新北市,板橋鎮縣府,71,隔日，板橋鎮秩序也失控，民眾陸續衝入縣府，毆打職員。,自2月28日下午，臺北市發生長官公署前衛兵開槍事件，造成臺灣群眾累積已久的不滿情緒爆發而怒打「外省人」的情形後，消息透過電臺廣播及民眾口耳相傳，衝突事件因而逐漸擴大至全臺各地。如北部地區大多在當日下午或傍晚時分即傳出零星衝突：以基隆為例，在事件發生後當晚，已有群眾攻擊警察局、派出所、機關宿舍等，以及毆打外省人和軍人的情形。[70]隔日，板橋鎮秩序也失控，民眾陸續衝入縣府，毆打職員。部份群眾則襲擊供應局倉庫，搬走軍用物資，並放火燒毀倉庫；[71]士林與新店地區發生供應局物資被搶、武器被劫之情形；淡水、瑞芳等地則是毆打外省人，金瓜石銅礦籌備處職員宿舍被搗毀；[72]桃園鎮自1日起接收縣政府及驅趕警局官員；[73]新竹市則於3月2日清晨，有一批從臺北來到新竹的青年和學生，開著卡車到處演講，說明事件經過，並呼籲民眾參加起義。是時，市民開始毆打外省人，或是搗毀外省人經營的商店，或是分頭襲擊派出所、法院、市府機關 and 官員宿舍；[74]宜蘭因離臺北市有些距離，因此對事件的反應較慢，3月4日地方民眾收繳宜蘭機場倉庫及市警察局槍械，以及將外省人悉數集中保護和設立救護所，救護傷患。[75],ch02_0001_1.2.1_一各地衝突的擴大
E0067,1947-03-01,1947-03-01,1947-03-01,False,,False,fuzzy,隔日,,,其他,新北市,供應局倉庫,71,部份群眾則襲擊供應局倉庫，搬走軍用物資，並放火燒毀倉庫；[71],自2月28日下午，臺北市發生長官公署前衛兵開槍事件，造成臺灣群眾累積已久的不滿情緒爆發而怒打「外省人」的情形後，消息透過電臺廣播及民眾口耳相傳，衝突事件因而逐漸擴大至全臺各地。如北部地區大多在當日下午或傍晚時分即傳出零星衝突：以基隆為例，在事件發生後當晚，已有群眾攻擊警察局、派出所、機關宿舍等，以及毆打外省人和軍人的情形。[70]隔日，板橋鎮秩序也失控，民眾陸續衝入縣府，毆打職員。部份群眾則襲擊供應局倉庫，搬走軍用物資，並放火燒毀倉庫；[71]士林與新店地區發生供應局物資被搶、武器被劫之情形；淡水、瑞芳等地則是毆打外省人，金瓜石銅礦籌備處職員宿舍被搗毀；[72]桃園鎮自1日起接收縣政府及驅趕警局官員；[73]新竹市則於3月2日清晨，有一批從臺北來到新竹的青年和學生，開著卡車到處演講，說明事件經過，並呼籲民眾參加起義。是時，市民開始毆打外省人，或是搗毀外省人經營的商店，或是分頭襲擊派出所、法院、市府機關 and 官員宿舍；[74]宜蘭因離臺北市有些距離，因此對事件的反應較慢，3月4日地方民眾收繳宜蘭機場倉庫及市警察局槍械，以及將外省人悉數集中保護和設立救護所，救護傷患。[75],ch02_0001_1.2.1_一各地衝突的擴大
E0068,1947-03-01,1947-03-01,1947-03-01,True,,False,fuzzy,,,,其他,臺北市、新北市,士林與新店地區供應局物資倉庫,72,士林與新店地區發生供應局物資被搶、武器被劫之情形；,自2月28日下午，臺北市發生長官公署前衛兵開槍事件，造成臺灣群眾累積已久的不滿情緒爆發而怒打「外省人」的情形後，消息透過電臺廣播及民眾口耳相傳，衝突事件因而逐漸擴大至全臺各地。如北部地區大多在當日下午或傍晚時分即傳出零星衝突：以基隆為例，在事件發生後當晚，已有群眾攻擊警察局、派出所、機關宿舍等，以及毆打外省人和軍人的情形。[70]隔日，板橋鎮秩序也失控，民眾陸續衝入縣府，毆打職員。部份群眾則襲擊供應局倉庫，搬走軍用物資，並放火燒毀倉庫；[71]士林與新店地區發生供應局物資被搶、武器被劫之情形；淡水、瑞芳等地則是毆打外省人，金瓜石銅礦籌備處職員宿舍被搗毀；[72]桃園鎮自1日起接收縣政府及驅趕警局官員；[73]新竹市則於3月2日清晨，有一批從臺北來到新竹的青年和學生，開著卡車到處演講，說明事件經過，並呼籲民眾參加起義。是時，市民開始毆打外省人，或是搗毀外省人經營的商店，或是分頭襲擊派出所、法院、市府機關 and 官員宿舍；[74]宜蘭因離臺北市有些距離，因此對事件的反應較慢，3月4日地方民眾收繳宜蘭機場倉庫及市警察局槍械，以及將外省人悉數集中保護和設立救護所，救護傷患。[75],ch02_0001_1.2.1_一各地衝突的擴大
E0069,1947-03-01,1947-03-01,1947-03-01,True,,False,fuzzy,,,,其他,新北市,淡水、瑞芳、金瓜石銅礦籌備處,72,淡水、瑞芳等地則是毆打外省人，金瓜石銅礦籌備處職員宿舍被搗毀；[72],自2月28日下午，臺北市發生長官公署前衛兵開槍事件，造成臺灣群眾累積已久的不滿情緒爆發而怒打「外省人」的情形後，消息透過電臺廣播及民眾口耳相傳，衝突事件因而逐漸擴大至全臺各地。如北部地區大多在當日下午或傍晚時分即傳出零星衝突：以基隆為例，在事件發生後當晚，已有群眾攻擊警察局、派出所、機關宿舍等，以及毆打外省人和軍人的情形。[70]隔日，板橋鎮秩序也失控，民眾陸續衝入縣府，毆打職員。部份群眾則襲擊供應局倉庫，搬走軍用物資，並放火燒毀倉庫；[71]士林與新店地區發生供應局物資被搶、武器被劫之情形；淡水、瑞芳等地則是毆打外省人，金瓜石銅礦籌備處職員宿舍被搗毀；[72]桃園鎮自1日起接收縣政府及驅趕警局官員；[73]新竹市則於3月2日清晨，有一批從臺北來到新竹的青年和學生，開著卡車到處演講，說明事件經過，並呼籲民眾參加起義。是時，市民開始毆打外省人，或是搗毀外省人經營的商店，或是分頭襲擊派出所、法院、市府機關 and 官員宿舍；[74]宜蘭因離臺北市有些距離，因此對事件的反應較慢，3月4日地方民眾收繳宜蘭機場倉庫及市警察局槍械，以及將外省人悉數集中保護和設立救護所，救護傷患。[75],ch02_0001_1.2.1_一各地衝突的擴大
E0070,1947-03-01,1947-03-01,1947-03-01,False,,False,fuzzy,1日起,,,其他,桃園市,桃園鎮、縣政府、警局,73,桃園鎮自1日起接收縣政府及驅趕警局官員；[73],自2月28日下午，臺北市發生長官公署前衛兵開槍事件，造成臺灣群眾累積已久的不滿情緒爆發而怒打「外省人」的情形後，消息透過電臺廣播及民眾口耳相傳，衝突事件因而逐漸擴大至全臺各地。如北部地區大多在當日下午或傍晚時分即傳出零星衝突：以基隆為例，在事件發生後當晚，已有群眾攻擊警察局、派出所、機關宿舍等，以及毆打外省人和軍人的情形。[70]隔日，板橋鎮秩序也失控，民眾陸續衝入縣府，毆打職員。部份群眾則襲擊供應局倉庫，搬走軍用物資，並放火燒毀倉庫；[71]士林與新店地區發生供應局物資被搶、武器被劫之情形；淡水、瑞芳等地則是毆打外省人，金瓜石銅礦籌備處職員宿舍被搗毀；[72]桃園鎮自1日起接收縣政府及驅趕警局官員；[73]新竹市則於3月2日清晨，有一批從臺北來到新竹的青年和學生，開著卡車到處演講，說明事件經過，並呼籲民眾參加起義。是時，市民開始毆打外省人，或是搗毀外省人經營的商店，或是分頭襲擊派出所、法院、市府機關 and 官員宿舍；[74]宜蘭因離臺北市有些距離，因此對事件的反應較慢，3月4日地方民眾收繳宜蘭機場倉庫及市警察局槍械，以及將外省人悉數集中保護和設立救護所，救護傷患。[75],ch02_0001_1.2.1_一各地衝突的擴大
E0071,1947-03-01,1947-03-01,1947-03-01,False,,False,fuzzy,3月1日之後,,,其他,臺灣省,,93.0,等到3月1日之後，全臺各地陸續捲入衝突，情況已非長官公署或駐地軍警所能掌控[93],在此期間，臺灣省政治建設協會理事、臺北市商會理事長蔣渭川曾應陳儀的請託，出面幫忙收拾局面，呼籲省民須顧全大局和臺灣的前途。各地同志應「出來協助向民眾說明大義，制止妄動，速歸鎮靜，恢復秩序，並領導民眾準備迎憲的工作。」[92]唯此乃陳儀的緩兵之計，在國府軍隊尚未到臺灣前的權宜措施。其實在事件初起，在臺官員皆認為此次事件是由於「奸人」煽動，使得群眾盲從暴動，並未因此反躬自省或秉公懲辦，平息民怨。[93]等到3月1日之後，全臺各地陸續捲入衝突，情況已非長官公署或駐地軍警所能掌控，長官公署的處理態度就是先虛應敷衍，再分化打擊，一方面同意臺籍代表之要求，由官民共同組成「二二八事件處理委員會」，協調解決事件之衝突；另一方面，卻又分派軍情人員混入處委會，居中破壞或監控與會者，並且通令各地機關首長鎮靜處置，因應變化。期間雖曾發生高雄要塞司令彭孟緝出兵鎮壓屠殺，而遭陳儀指責，但事後仍受上級嘉許。事件演變至3月5日，全臺各地皆傳出地方機關、武器遭受接收之事；而中部地區、雲嘉南地區分別成立武裝部隊組織，臺北市則有處委會提出改組政府、民選縣市長的呼聲，這些已非陳儀原本預期能夠自行解決的情形，因而急電中央派兵鎮壓。[94]而在援軍仍未來臺之前，長官公署除仍與處委會繼續周旋，虛心假意接受處委會之各種要求，卻又從中分化組織、製造「叛亂」藉口，並且積極進行各種軍事整備與人員部署之工作，以求內外夾擊。到了3月7日，國府蔣主席電告陳儀，整編第21師及附屬部隊於本日正午由上海出發，約10日清晨可扺基隆。[95]陳儀等官員在得知中央援軍將至，乃開始翻臉不認人。3月10日，陳儀下令解散處委會及各地分會，並四處逮捕、暗殺處委會有關人士。至此，處委會居中調和、建言的任務宣告終結，原以為官方誠心誠意與民眾和平解決此事件，那想到陳儀大玩兩手策略，一方面與處委會妥協談和，一方面卻急電中央派兵鎮壓，並派出特務擾亂時局，以利鎮壓、搜捕民眾之藉口。天真的臺灣人民一再受到國府官員的欺騙與壓迫，這種無奈且怨忿的創痛深深烙印在心中，永遠無法忘懷。,ch02_0001_1.2.2_二改革要求的提出
E0072,1947-03-01,1947-03-01,1947-03-01,True,,False,fuzzy,,,依「前2日」推算,其他,高雄市,,102,惟早在前2日，地方軍政要員已獲知臺北二二八事件之消息，市長黃仲圖及高雄要塞司令彭孟緝即分別因應準備。[102],高雄市爆發衝突事件是從3月3日開始，惟早在前2日，地方軍政要員已獲知臺北二二八事件之消息，市長黃仲圖及高雄要塞司令彭孟緝即分別因應準備。[102]惟高雄要塞司令彭孟緝因作風強悍，使得高雄市的衝突無任何和平理性的轉圜餘地，如3月5日有部份青年學生欲攻擊要塞司令部，彭氏以日語喊話，要民眾繳械投降，並以機槍掃射鼓山地區及以七五砲砲擊高雄市體育場示威要脅。下午2時，乃由市長黃仲圖、議長彭清靠及地方人士等7人上山與彭氏談判，彭氏因準備不及藉故拖延，以考慮所提條件為由，希望市長等人隔日再來協商。殊不知翌日，待一行人抵達要塞司令部，並與彭氏討論後，詎料彭氏竟拍桌怒斥，大呼來人；而彭氏事後卻推說凃光明欲拔槍射擊，乃遭彭氏副官撲身制止。結果談判不成，反將凃光明、范滄榕、曾豐明3人逮捕槍斃，其餘監禁該部。[103],ch02_0001_1.3.1_一高雄市的鎮壓行動
