event_id,datetime_utc,datetime_local,date,date_uncertain,time_local,time_known,time_precision,time_label,time_category,time_note,region,city,place,refs,event_zh,context_zh,source_chapter
E0140,1947-03-07,1947-03-07,1947-03-07,False,,False,fuzzy,,,,其他,南京市,蔣介石官邸,103.0,於是李翼中自告奮勇攜帶陳儀的信函，於3月7日（6日無航機未成行）搭機飛南京，面見蔣介石於官邸，除報告臺灣情勢、善後方策，更表示「臺灣兵力薄弱，似非加派勁旅不足以資鎮懾，陳長官且望中央派大員協助處理。」蔣介石回答「已派兵前往，本日可達，余已決定派白部長赴臺宣慰。」[103],事變發生之初，陳儀宣佈臨時戒嚴的同一天即以電報呈蔣：「臺省防共素嚴，惟27日奸匪勾結流氓，乘專賣局查禁私煙機會聚眾暴動，傷害外省籍人員，特於28日宣佈臨時戒嚴，必要時當遵令權宜處置。」[102]3月1日，省黨部主任委員李翼中赴長官公署訪陳儀，問他「臺北軍警足供使用否？」陳儀回答「可勿慮」，等到3月5日事件仍未平息，李翼中再訪陳儀，就建議「何如速請中樞加派勁旅且選派大員為助，俾事件得早日敉平」，陳儀的回答是「余亦有此意」，於是李翼中自告奮勇攜帶陳儀的信函，於3月7日（6日無航機未成行）搭機飛南京，面見蔣介石於官邸，除報告臺灣情勢、善後方策，更表示「臺灣兵力薄弱，似非加派勁旅不足以資鎮懾，陳長官且望中央派大員協助處理。」蔣介石回答「已派兵前往，本日可達，余已決定派白部長赴臺宣慰。」[103]關於李翼中親手轉呈的信函，陳儀在其中詳述2月28日以來的經過情形、原因分析、處置態度，提到「此後對付臺灣之態度，⋯對於奸黨亂徒，須以武力消滅，不能容其存在」，最後還說：「鈞座可派大員來臺協同辦理，但為保持臺灣使其為中華民國的臺灣計，必須迅派得力軍隊來臺. 如派大員，亦須俟軍隊到臺以後，否則亦恐難生效力。」[104]一般以為簡派大員來臺是屬於安撫、和解的表示，與「武力解決」意義相反，但陳儀把它們視為一體，值得注意。陳儀的焦躁不安到了3月7日更為顯露，他覺得蔣決派第21師師部及步兵一團、憲兵一營來臺「不敷戡亂之用，擬請除第21師全部開來外，再加開一師，至少一旅，並派湯恩伯來臺指揮，在最短期間，予以澈底肅清。」[105],ch03_0002_1.2_二蔣介石掌握事變中的各種資訊
E0141,1947-03-07,1947-03-07,1947-03-07,False,,False,fuzzy,,,,其他,南京市,,104.0,關於李翼中親手轉呈的信函，陳儀在其中詳述2月28日以來的經過情形、原因分析、處置態度，提到「此後對付臺灣之態度，⋯對於奸黨亂徒，須以武力消滅，不能容其存在」，最後還說：「鈞座可派大員來臺協同辦理，但為保持臺灣使其為中華民國的臺灣計，必須迅派得力軍隊來臺. 如派大員，亦須俟軍隊到臺以後，否則亦恐難生效力。」[104],事變發生之初，陳儀宣佈臨時戒嚴的同一天即以電報呈蔣：「臺省防共素嚴，惟27日奸匪勾結流氓，乘專賣局查禁私煙機會聚眾暴動，傷害外省籍人員，特於28日宣佈臨時戒嚴，必要時當遵令權宜處置。」[102]3月1日，省黨部主任委員李翼中赴長官公署訪陳儀，問他「臺北軍警足供使用否？」陳儀回答「可勿慮」，等到3月5日事件仍未平息，李翼中再訪陳儀，就建議「何如速請中樞加派勁旅且選派大員為助，俾事件得早日敉平」，陳儀的回答是「余亦有此意」，於是李翼中自告勇攜帶陳儀的信函，於3月7日（6日無航機未成行）搭機飛南京，面見蔣介石於官邸，除報告臺灣情勢、善後方策，更表示「臺灣兵力薄弱，似非加派勁旅不足以資鎮懾，陳長官且望中央派大員協助處理。」蔣介石回答「已派兵前往，本日可達，余已決定派白部長赴臺宣慰。」[103]關於李翼中親手轉呈的信函，陳儀在其中詳述2月28日以來的經過情形、原因分析、處置態度，提到「此後對付臺灣之態度，⋯對於奸黨亂徒，須以武力消滅，不能容其存在」，最後還說：「鈞座可派大員來臺協同辦理，但為保持臺灣使其為中華民國的臺灣計，必須迅派得力軍隊來臺. 如派大員，亦須俟軍隊到臺以後，否則亦恐難生效力。」[104]一般以為簡派大員來臺是屬於安撫、和解的表示，與「武力解決」意義相反，但陳儀把它們視為一體，值得注意。陳儀的焦躁不安到了3月7日更為顯露，他覺得蔣決派第21師師部及步兵一團、憲兵一營來臺「不敷戡亂之用，擬請除第21師全部開來外，再加開一師，至少一旅，並派湯恩伯來臺指揮，在最短期間，予以澈底肅清。」[105],ch03_0002_1.2_二蔣介石掌握事變中的各種資訊
E0142,1947-03-07,1947-03-07,1947-03-07,False,,False,fuzzy,3月7日,,,其他,臺北市,,105.0,陳儀的焦躁不安到了3月7日更為顯露，他覺得蔣決派第21師師部及步兵一團、憲兵一營來臺「不敷戡亂之用，擬請除第21師全部開來外，再加開一師，至少一旅，並派湯恩伯來臺指揮，在最短期間，予以澈底肅清。」[105],事變發生之初，陳儀宣佈臨時戒嚴的同一天即以電報呈蔣：「臺省防共素嚴，惟27日奸匪勾結流氓，乘專賣局查禁私煙機會聚眾暴動，傷害外省籍人員，特於28日宣佈臨時戒嚴，必要時當遵令權宜處置。」[102]3月1日，省黨部主任委員李翼中赴長官公署訪陳儀，問他「臺北軍警足供使用否？」陳儀回答「可勿慮」，等到3月5日事件仍未平息，李翼中再訪陳儀，就建議「何如速請中樞加派勁旅且選派大員為助，俾事件得早日敉平」，陳儀的回答是「余亦有此意」，於是李翼中自告奮勇攜帶陳儀的信函，於3月7日（6日無航機未成行）搭機飛南京，面見蔣介石於官邸，除報告臺灣情勢、善後方策，更表示「臺灣兵力薄弱，似非加派勁旅不足以資鎮懾，陳長官且望中央派大員協助處理。」蔣介石回答「已派兵前往，本日可達，余已決定派白部長赴臺宣慰。」[103]關於李翼中親手轉呈的信函，陳儀在其中詳述2月28日以來的經過情形、原因分析、處置態度，提到「此後對付臺灣之態度，⋯對於奸黨亂徒，須以武力消滅，不能容其存在」，最後還說：「鈞座可派大員來臺協同辦理，但為保持臺灣使其為中華民國的臺灣計，必須迅派得力軍隊來臺. 如派大員，亦須俟軍隊到臺以後，否則亦恐難生效力。」[104]一般以為簡派大員來臺是屬於安撫、和解的表示，與「武力解決」意義相反，但陳儀把它們視為一體，值得注意。陳儀的焦躁不安到了3月7日更為顯露，他覺得蔣決派第21師師部及步兵一團、憲兵一營來臺「不敷戡亂之用，擬請除第21師全部開來外，再加開一師，至少一旅，並派湯恩伯來臺指揮，在最短期間，予以澈底肅清。」[105],ch03_0002_1.2_二蔣介石掌握事變中的各種資訊
E0143,1947-03-07,1947-03-07,1947-03-07,False,,False,fuzzy,,,,其他,臺北市,,108.0,3月7日的一封電報透露了陳儀的心跡：「日前我因限於武力，十分容忍，第21師全部到達後，當收斧亂之效。」[108],陳儀在3月2日的電臺廣播尚且表明「既往不究」、一律「優以撫卹」的寬大態度[106]，為何3月5日、6日、7日的態度丕變？曾有學者解釋3月2日以前「陳儀的確很誠意地在尋求和解」，但由於「日漸增高的反政府行動」方才決定以軍力解決問題[107]，實則，3月7日的一封電報透露了陳儀的心跡：「日前我因限於武力，十分容忍，第21師全部到達後，當收斧亂之效。」[108],ch03_0002_1.2_二蔣介石掌握事變中的各種資訊
E0144,1947-03-07,1947-03-07,1947-03-07,True,,False,fuzzy,,,蔣介石對此電報之反應與3月7日派兵決策相關,其他,臺北市,外國領事館,113.0,蔣渭川，亦以臺灣政治建設協會名義發出籲請中央電，蔣介石因而對陳儀說：「臺灣政治建設促進（協）會由外國領館轉余一電，其間有請勿派兵來臺否則情勢必更嚴重云，余置之不理，此必反動份子在外國領館製造恐怖所演成。」[113],如上所述，蔣介石的訊息來源包括黨（李翼中）、政（陳儀）、軍（桂永清）、特（保密局），此外，又如3月5日憲兵司令張鎮，已將臺變的性質認定為「叛國奪取政權之階段」、「地方政府完全失卻統御能力」[109]，3月6日中統局也有誇大危情的報告：「臺中嘉義市政府政權已被所謂二二八事件處理委員會篡奪，並電告省參議員王添灯，轉告公署勿派兵前往，否則以武力對付。」[110]不過，臺灣人菁英或團體則反映了不同的意見，如省參議會議長黃朝琴曾於3月6日呈蔣電：「臺北民眾暴動實緣省署施政有失民心積怨所致，⋯⋯除嘉義軍民尚在衝突外，其他各地秩序已漸恢復，⋯⋯外傳託治及獨立並非事實，擁護中央熱誠如故。⋯⋯敬乞速決治臺方針，簡派大員來臺處理，以免事件擴大，貽笑外人。」[111]黃朝琴講的都是重點，包括事件原因、秩序恢復、非關託治獨立等，結論是希望政府讓步（改革省政）、政治解決為宜. 同樣地，一封「全體參政員」給蔣的電報，除了建議廢止專賣局、縣市長民選等等以外，還建議「速派大員來臺協同處理本案，勿用武力彈壓，以免事態擴大。」[112]甚至，在事件過程中與陳儀、李翼中、張慕陶、柯遠芬都有聯絡的蔣渭川，亦以臺灣政治建設協會名義發出籲請中央電，蔣介石因而對陳儀說：「臺灣政治建設促進（協）會由外國領館轉余一電，其間有請勿派兵來臺否則情勢必更嚴重云，余置之不理，此必反動份子在外國領館製造恐怖所演成。」[113],ch03_0002_1.2_二蔣介石掌握事變中的各種資訊
E0145,1947-03-07,1947-03-07,1947-03-07,False,,False,fuzzy,,,,其他,基隆市;高雄市,基隆;左營,127,從檔案可以看到早在3月7日，蔣介石即曾指令太康艦、伏波艦開赴基隆歸陳儀指揮，美頌、美樂二艦開赴左營由海軍司令黃緒虞指揮,關於蔣介石的派兵，較少被注意的是海軍部分。3月7日國民政府參軍處軍務局局長俞濟時把陳儀請兵的來電抄呈蔣介石，附註的地方出現一段海軍的消息：「本（10）日14時接海軍總部周參謀長憲章電話稱，接臺灣9日來電，基隆之叛兵司令部已為我海軍及要塞部隊驅逐，又盤據左營汽油廠之叛兵，已為我海軍肅清，俘獲百餘人，繳獲槍枝數十支等情。」126可見至少在基隆與高雄左營兩個海港，海軍發揮相當作用。從檔案可以看到早在3月7日，蔣介石即曾指令太康艦、伏波艦開赴基隆歸陳儀指揮，美頌、美樂二艦開赴左營由海軍司令黃緒虞指揮127，不過3月10日桂永清簽呈稱，美頌美樂二艦恐不能及時到達，已電飭戰車登陸艦「中海」由滬開基隆。128臺灣省警備司令部在3月15日致電海軍總司令部：「太康中海已於真元先後抵基隆。」129陳儀又在3月22日致電桂永清：「本省此次事件承派三艦來臺協助平亂，至為感荷。茲太康號高艦長以臺局日趨平定，面請解除此間任務⋯⋯。」130所謂三艦，應是指太康、伏波、中海而言。海島臺灣發生事變，海軍的角色自是舉足輕重。,ch03_0002_1.3_三蔣介石調兵遣將
E0146,1947-03-07,1947-03-07,1947-03-07,False,,False,fuzzy,,,,其他,臺北市,二二八事件處理委員會,147.0,3月7日臺北處委會提出的32條（42條）要求,蔣介石派兵之後，應即預知「糜爛」的後果，因而3月10日首度公開談論臺灣事變的時候，把派兵決策歸因於3月7日處理委員會提出「逾越地方政治之範圍」的「無理要求」，和隨後的襲擊官署行動，此說顯然與各種檔案證據顯示的「時點」不同，本文根據檔案認為蔣介石最慢在3月5日已經開始調兵遣將—若根據整編第21師師部副官處長何聘儒的記載，甚至3月3日在江蘇崑山駐地即已接到蔣主席要求「開臺平亂」的電令。[146]然而，有學者接受前述蔣介石3月7日始決定派兵的片面說法，認為3月7日臺北處委會提出的32條（42條）要求「有明顯叛變色彩」，因而「排除了和解的可能」，「異議份子的條件越來越激進，而省及中央政府的態度從妥協和解轉變為高壓鎮暴。」[147]實則42條要求涵蓋人身自由、縣市長民選、多用本省人擔任主管、撤銷專賣局與貿易局等等都在合乎情理的範圍，至於要求駐臺軍隊「暫時解除武裝」以免繼續流血衝突，要求撤銷警備司令部「以免軍權濫用」，容或不切實際，也談不上什麼叛變色彩。可見，欲以處委會提出激進、叛變的要求作為蔣介石派兵正當的藉口，顯然不能成立。值得注意的是，3月7日處委會提出的要求中有一條：「政府切勿再移動兵力或向中央請遣兵力，企圖以武力解決事件，致發生更慘重之流血而受國際干涉。」顯示他們的焦慮和關切，只是，3月7日那天傍晚來自福建的憲兵營已經登船出發，而整編第21師也已經往吳淞口和連雲港集結，箭在弦上、不得不發了。,ch03_0002_1.4_四蔣介石袒護陳儀臺省軍政首長事後無一受懲
E0147,1947-03-07T10:00:00Z,1947-03-07T18:00:00+08:00,1947-03-07,False,18:00,True,fuzzy,傍晚,傍晚,,其他,臺北市,臺灣省行政長官公署,90.0,當日傍晚，一行人赴長官公署將所決議的大綱及要求面呈陳儀，卻被陳儀斷然拒絕，且「將文件擲地三尺以外」，令在場代表「相顧失色」。[90],3月6日至7日，處委會仍持續開會運作，除了6日選出常務委員，共計有林獻堂、王添灯等17名、候補2名之外[88]，另在7日於混亂情況中，通過王添灯所草擬的「32條處理大綱」以及其他人士表決附議的十項要求。[89]當日傍晚，一行人赴長官公署將所決議的大綱及要求面呈陳儀，卻被陳儀斷然拒絕，且「將文件擲地三尺以外」，令在場代表「相顧失色」。[90]會後，王添灯向中外廣播，說明二二八事件的原因和經過，並宣讀32條大綱內文以及被陳儀拒絕的詳情。最後沉痛地表示：「處委會的使命已經完了，從今以後，這次事件已不能單由處委會來處理，只有全體省民的力量才能解決，同時也才能達成全體省民的合理要求，希望全體同胞繼續奮鬥。」[91],ch02_0001_1.2.2_二改革要求的提出
E0148,1947-03-07T10:00:00Z,1947-03-07T18:00:00+08:00,1947-03-07,False,18:00,True,fuzzy,傍晚,晚上,,其他,福建省,,,只是，3月7日那天傍晚來自福建的憲兵營已經登船出發，而整編第21師也已經往吳淞口和連雲港集結，箭在弦上、不得不發了。,蔣介石派兵之後，應即預知「糜爛」的後果，因而3月10日首度公開談論臺灣事變的時候，把派兵決策歸因於3月7日處理委員會提出「逾越地方政治之範圍」的「無理要求」，和隨後的襲擊官署行動，此說顯然與各種檔案證據顯示的「時點」不同，本文根據檔案認為蔣介石最慢在3月5日已經開始調兵遣將—若根據整編第21師師部副官處長何聘儒的記載，甚至3月3日在江蘇崑山駐地即已接到蔣主席要求「開臺平亂」的電令。[146]然而，有學者接受前述蔣介石3月7日始決定派兵的片面說法，認為3月7日臺北處委會提出的32條（42條）要求「有明顯叛變色彩」，因而「排除了和解的可能」，「異議份子的條件越來越激進，而省及中央政府的態度從妥協和解轉變為高壓鎮暴。」[147]實則42條要求涵蓋人身自由、縣市長民選、多用本省人擔任主管、撤銷專賣局與貿易局等等都在合乎情理的範圍，至於要求駐臺軍隊「暫時解除武裝」以免繼續流血衝突，要求撤銷警備司令部「以免軍權濫用」，容或不切實際，也談不上什麼叛變色彩。可見，欲以處委會提出激進、叛變的要求作為蔣介石派兵正當的藉口，顯然不能成立。值得注意的是，3月7日處委會提出的要求中有一條：「政府切勿再移動兵力或向中央請遣兵力，企圖以武力解決事件，致發生更慘重之流血而受國際干涉。」顯示他們的焦慮和關切，只是，3月7日那天傍晚來自福建的憲兵營已經登船出發，而整編第21師也已經往吳淞口和連雲港集結，箭在弦上、不得不發了。,ch03_0002_1.4_四蔣介石袒護陳儀臺省軍政首長事後無一受懲
E0149,1947-03-08,1947-03-08,1947-03-08,False,,False,fuzzy,,不詳,,其他,嘉義市,水上機場,100,3月8日，機場守軍糧食有匱乏之情形，然由於得自臺北空運與民間的補給，情況逐漸好轉；又和民軍之和談也暫時達成協議，機場水電恢復供應。,另在雲嘉地區的武裝流血衝突中，地方武力主要來自於中南部各地支援的青年或學生所組成的民軍。衝突開始於3月5日，嘉義民軍發動攻擊紅毛埤軍械庫以及水上機場，戰況激烈，民軍傷亡慘重，期間曾有阿里山原住民及臺中、斗六的武裝部隊前來增援民軍，形成與機場、紅毛埤守軍互相對峙的情形。983月6日，守軍與地方處委會雙方談判協商，主要為軍隊繳械、民間提供糧食給守軍。同日，另一支民軍則包圍雲林縣的虎尾機場駐軍，雙方爆發激烈戰鬥。是夜，駐守軍隊因糧食不足等原因，乃突圍而出，逃往林內。993月7日，民軍又攻下紅毛埤軍火庫，國府守軍在撤退前放火焚毀庫房物資，隨後轉往機場。3月8日，機場守軍糧食有匱乏之情形，然由於得自臺北空運與民間的補給，情況逐漸好轉；又和民軍之和談也暫時達成協議，機場水電恢復供應.100最後在國府援軍源源不絕地進入中南部地區後，部分民軍乃逃往嘉義小梅山中，進行長期游擊戰。,ch02_0001_1.2.3_三武裝流血衝突
E0150,1947-03-08T04:00:00Z,1947-03-08T12:00:00+08:00,1947-03-08,False,12:00,True,fuzzy,下午,下午,,其他,基隆市,基隆港,108.0,3月8日下午，閩台監察使楊亮功與憲兵二營在基隆登陸後 [108],3月8日下午，閩台監察使楊亮功與憲兵二營在基隆登陸後，當天晚上，在臺軍警開始反撲報復。然而，早在8日前一日，陳儀即下令準備各種配合援軍的各項工作，包括集合所有部隊待命、保持臺北基隆間交通及電廠之安全、監視處委會人員之活動。[108]8日夜10時30分，長官公署下令攻擊處委會，一時之間槍聲大作，與會者或遭捕殺或開槍反擊，場面混亂不已。除此之外，在圓山、警總、長官公署、臺灣銀行及其他地區也不時傳出槍聲。[109],ch02_0001_1.3.2.1_1_北基宜地區
E0151,1947-03-08,1947-03-08,1947-03-08,False,,False,fuzzy,3月8日,其他,部隊進駐後即展開行動,其他,屏東縣,屏東縣市市區,121,屏東縣市則於3月8日第21師劉和嘯部隊進駐後，市區憲警即開始拘捕「人犯」，並收繳武器、清查戶口、恢復秩序、「懲辦禍首」、撫恤傷患、調查損失等「清鄉」要項。[121],屏東縣市則於3月8日第21師劉和嘯部隊進駐後，市區憲警即開始拘捕「人犯」，並收繳武器、清查戶口、恢復秩序、「懲辦禍首」、撫恤傷患、調查損失等「清鄉」要項。至4月5日結束「清鄉」時，本縣共130名「嫌疑犯」遭到逮捕。[121],ch02_0001_1.3.2.5_5_高屏地區
E0152,1947-03-08,1947-03-08,1947-03-08,False,,False,fuzzy,3月8日,none,,其他,臺北市,行政長官公署,129,3月8日，福建臺灣監察使楊亮功奉派來臺查辦事變；,在「綏靖與清鄉」期間，國民政府為疏緩臺灣人民因軍事鎮壓所引起的恐慌與不滿，以及長官公署體制的不當，乃積極進行調查、「宣慰」與長官公署體制的改制。3月8日，福建臺灣監察使楊亮功奉派來臺查辦事變；3月10日，楊亮功對中央社記者發表談話指出：「中央對於臺省此次發生的不幸事件，極為關懷，特電令本人前來查辦。現本人剛到此間，一切情形尚欠明瞭，希望各方人士儘量供給意見，俾可轉達中央。本人以為目前最迫切之事，莫如發揮同胞愛之精神，不分彼此，迅即恢復社會秩序，安定人民生活。中央素以寬大為懷，蔣主席對於臺灣地方之重視及對於臺胞愛護之懇摯，可從蔣主席上次蒞臺時所發表之言論中見之，毋待贅述。本人相信中央對於此次事件必有合法合理之解決。」[129]楊氏隨即分赴行政長官公署、各軍警機關及學校，以及各縣市視察。3月17日，國防部部長白崇禧奉派偕同陸軍總部副參謀長冷欣、「三民主義青年團」中央團部第2處處長蔣經國等一行14人來臺「宣慰」。白崇禧抵台後，隨即對臺民廣播，宣示政府的「寬大」政策及處理原則，希望全臺同胞尊重法紀、迅速恢復社會秩序。[130]白氏在臺「宣慰」行程中，除走訪全台南北各地視察政府機關單位外，又與地方鄉親父老座談，藉此聽取各地人士意見，期間並要求軍警人員不得挾怨報復，嫌疑人犯皆應秉公速審，參加「暴動」青年學生免究等原則，因而使臺籍傷亡人數得以減少。3月22日，監察院派遣監察委員何漢文來臺，協助楊亮功進行調查。楊亮功、何漢文在臺調查事變期間，曾與國防部長白崇禧交換處理事變之意見，他們的職責雖不相同，但意見大致相似。[131]4月2日，白崇禧返回南京，結束約二週的「宣慰」行程。4月11日，楊亮功等亦搭船轉滬返京，除向監察院院長于右任報告二二八事件詳情，並就政治、經濟、教育、善後處理四方面撰擬報告書，建議今後改革意見；隨即晉見國民政府主席蔣介石，面陳事變經過。[132],ch02_0001_1.4_四調查宣慰與長官公署的改制
E0153,1947-03-08,1947-03-08,1947-03-08,False,,False,fuzzy,從3月8日開始,none,,其他,南京市,,133,從3月8日開始，國府主席兼國民黨總裁蔣介石即囑託國民黨中央組織部長陳立夫與臺灣省黨部主委李翼中進行擬定「臺灣二二八事件處理辦法要點」，其內容大致包括改制長官公署為省政府制、省主席不兼警備司令、省府委員各廳處長儘量起用臺人、縣市長提前民選、政府機關中之臺人外省人待遇應一律平等、民生工業之公營範圍盡量減小、現行政經政策與中央法令牴觸者應修正或廢止等八項改革。[133],另一方面，國民政府亦著手進行長官公署體制的改制計畫。從3月8日開始，國府主席兼國民黨總裁蔣介石即囑託國民黨中央組織部長陳立夫與臺灣省黨部主委李翼中進行擬定「臺灣二二八事件處理辦法要點」，其內容大致包括改制長官公署為省政府制、省主席不兼警備司令、省府委員各廳處長儘量起用臺人、縣市長提前民選、政府機關中之臺人外省人待遇應一律平等、民生工業之公營範圍盡量減小、現行政經政策與中央法令牴觸者應修正或廢止等八項改革。[133]3月10日，國防部長白崇禧與陳立夫、李翼中等人將所擬定之「處理臺灣事件辦法」簽報給國府主席蔣介石。[134]3月17日，蔣介石即將此處理辦法對臺灣民眾廣播，呼籲臺灣同胞確保守法精神、恢復社會秩序、為建設臺灣、建設「祖國」而努力。[135]4月22日，行政院院會決議撤銷臺灣省行政長官公署，改制為臺灣省政府，並撤換陳儀，改派曾任駐美大使、素有開明之譽的立法院副院長魏道明為首任臺灣省政府主席。4月29日，行政院核定臺灣省政府委員、廳長、處長人選，在全部22名之中，臺籍人士佔12名，剛好過半數。[136]5月16日，臺灣省政府正式成立。,ch02_0001_1.4_四調查宣慰與長官公署的改制
